{
  "$schema":"https://json-schema.org/draft/2020-12/schema","$id":"https://ubuddy.invalid/schemas/cp-rir-model-set-differential-v0.json","type":"object","additionalProperties":false,
  "required":["$schema","schemaVersion","status","grammarDigest","candidateId","baseline","worlds","actions","comparisons","implementationStatus"],
  "properties":{"$schema":{"const":"ubuddy-cp-rir-model-set-differential-v0.schema.json"},"schemaVersion":{"const":"cp-rir/model-set-differential/v0"},"status":{"const":"illustrative_v0_draft"},"grammarDigest":{"type":"string","pattern":"^[a-f0-9]{64}$"},"candidateId":{"type":"string","minLength":1},"baseline":{"type":"object","additionalProperties":false,"required":["actionId","candidateIndependent","valueByWorld","cost"],"properties":{"actionId":{"type":"string"},"candidateIndependent":{"const":true},"valueByWorld":{"type":"object","minProperties":1,"additionalProperties":{"type":"number"}},"cost":{"type":"number","exclusiveMinimum":0}}},"worlds":{"type":"array","minItems":2,"items":{"type":"object","additionalProperties":false,"required":["worldId"],"properties":{"worldId":{"type":"string","minLength":1}}}},"actions":{"type":"array","minItems":1,"items":{"type":"object","additionalProperties":false,"required":["actionId","cost","safeByWorld","valueByWorld"],"properties":{"actionId":{"type":"string","minLength":1},"cost":{"type":"number","exclusiveMinimum":0},"safeByWorld":{"type":"object","minProperties":1,"additionalProperties":{"type":"boolean"}},"valueByWorld":{"type":"object","minProperties":1,"additionalProperties":{"type":"number"}}}}},"comparisons":{"type":"array","minItems":3,"items":{"type":"object","additionalProperties":false,"required":["comparisonId","relation","baseWorldIds","variantWorldIds","sameGrammar","candidateIndependent","baselineUnchanged"],"properties":{"comparisonId":{"type":"string"},"relation":{"enum":["EXPAND","DELETE","PERMUTE"]},"baseWorldIds":{"type":"array","minItems":1,"items":{"type":"string"},"uniqueItems":true},"variantWorldIds":{"type":"array","minItems":1,"items":{"type":"string"},"uniqueItems":true},"sameGrammar":{"const":true},"candidateIndependent":{"const":true},"baselineUnchanged":{"const":true}}}},"implementationStatus":{"const":"prototype/unverified"}}
}
