{
  "$schema":"ubuddy-cp-rir-model-set-differential-v0.schema.json","schemaVersion":"cp-rir/model-set-differential/v0","status":"illustrative_v0_draft","grammarDigest":"dddddddddddddddddddddddddddddddddddddddddddddddddddddddddddddddd","candidateId":"policy-probe-then-bind-v0",
  "baseline":{"actionId":"noop-positive-v0","candidateIndependent":true,"valueByWorld":{"w-hard-upstream":0.1,"w-hard-cache":0.1},"cost":1},"worlds":[{"worldId":"w-hard-upstream"},{"worldId":"w-hard-cache"}],
  "actions":[{"actionId":"probe-then-repair","cost":3,"safeByWorld":{"w-hard-upstream":true,"w-hard-cache":true},"valueByWorld":{"w-hard-upstream":0.8,"w-hard-cache":0.7}},{"actionId":"unsafe-static-bind","cost":1,"safeByWorld":{"w-hard-upstream":false,"w-hard-cache":true},"valueByWorld":{"w-hard-upstream":0.9,"w-hard-cache":0.9}}],
  "comparisons":[{"comparisonId":"expand-hard-world","relation":"EXPAND","baseWorldIds":["w-hard-upstream"],"variantWorldIds":["w-hard-upstream","w-hard-cache"],"sameGrammar":true,"candidateIndependent":true,"baselineUnchanged":true},{"comparisonId":"delete-hard-world","relation":"DELETE","baseWorldIds":["w-hard-upstream","w-hard-cache"],"variantWorldIds":["w-hard-upstream"],"sameGrammar":true,"candidateIndependent":true,"baselineUnchanged":true},{"comparisonId":"permute-world-order","relation":"PERMUTE","baseWorldIds":["w-hard-upstream","w-hard-cache"],"variantWorldIds":["w-hard-cache","w-hard-upstream"],"sameGrammar":true,"candidateIndependent":true,"baselineUnchanged":true}],"implementationStatus":"prototype/unverified"
}
